{
  "$schema": "https://json-schema.org/draft/2020-12/schema",
  "$id": "measurement.schema.json",
  "type": "object",
  "additionalProperties": false,
  "allOf": [
    {"if":{"properties":{"publication_status":{"const":"published"}}},"then":{"properties":{"public_measurement_id":{"type":"string"},"public_setup_id":{"type":"string"}}}},
    {"if":{"properties":{"publication_status":{"const":"draft"}}},"then":{"properties":{"public_measurement_id":{"type":"null"},"public_setup_id":{"type":"null"}}}},
    {"if":{"properties":{"measurement_type":{"const":"rpm_measurement"}}},"then":{"properties":{"conditions":{"$ref":"#/$defs/rpmConditions"},"results":{"$ref":"#/$defs/rpmResults"}}}},
    {"if":{"properties":{"measurement_type":{"const":"vibration_measurement"}}},"then":{"properties":{"conditions":{"$ref":"#/$defs/vibrationConditions"},"results":{"$ref":"#/$defs/vibrationResults"}}}}
  ],
  "required": ["schema_version", "measurement_uuid", "public_measurement_id", "setup_uuid", "public_setup_id", "publication_status", "measurement_type", "measurement_datetime", "measurement_datetime_local", "measurement_started_at", "measurement_completed_at", "measurement_timezone", "creator", "publisher", "software", "automatic_provenance", "conditions", "setup_snapshot", "results", "provenance", "files", "license", "measurement_authors", "recommended_citation"],
  "properties": {
    "$schema":{"type":"string"}, "schema_version": {"const": "2.0.0"}, "measurement_uuid": {"type": "string", "format": "uuid"},
    "public_measurement_id": {"type": ["string", "null"], "pattern": "^RL-[0-9]{4}-[0-9]{4,}$"},
    "setup_uuid": {"type": "string", "format": "uuid"},
    "public_setup_id": {"type": ["string", "null"], "pattern": "^DSR-SETUP-[0-9]{4,}$"},
    "publication_status": {"enum": ["draft", "submission", "published"]},
    "measurement_type": {"enum": ["rpm_measurement", "vibration_measurement"]},
    "measurement_datetime": {"type": "string", "format":"date-time", "description":"Canonical archive measurement timestamp: capture completion, identical to measurement_completed_at."}, "measurement_datetime_local":{"type":"string","format":"date-time","description":"Local-offset representation of the canonical completion timestamp; measurement_timezone identifies the IANA zone."}, "measurement_started_at":{"oneOf":[{"type":"string","format":"date-time"},{"type":"null"}],"description":"Instant capture began, derived from completion time and stored duration."}, "measurement_completed_at":{"type":"string","format":"date-time","description":"Instant capture completed; authoritative measurement timestamp."}, "measurement_timezone": {"type": "string", "minLength": 1},
    "creator": {"$ref": "#/$defs/creator"}, "measurement_authors": {"type": "array", "items": {"$ref": "#/$defs/creator"}},
    "submitter": {"oneOf":[{"$ref":"#/$defs/submitter"},{"type":"null"}]}, "publication_consent": {"oneOf":[{"$ref":"#/$defs/consent"},{"type":"null"}]},
    "recommended_citation": {"type": "string"}, "publisher": {"$ref":"#/$defs/publisher"}, "software": {"$ref":"#/$defs/software"}, "automatic_provenance": {"$ref":"#/$defs/automaticProvenance"},
    "conditions": {}, "setup_snapshot": {"$ref":"#/$defs/setupSnapshot"}, "results": {},
    "provenance": {"$ref":"#/$defs/provenance"}, "files":{"$ref":"#/$defs/files"}, "license": {"const": "CC-BY-4.0"},
    "record_version":{"type":"string"},"title":{"type":"string"},"slug":{"type":["string","null"]},"language":{"type":"string"},"date_published":{"oneOf":[{"type":"string","format":"date-time"},{"type":"null"}]},"source_measurement_uuids":{"type":"array"},"measurement_scope":{"type":"array"},"related_applications":{"type":"array"},"related_measurements":{"type":"array"},"interpretation":{"type":"object"},"keywords":{"type":"array","items":{"type":"string"}}
  },
  "$defs": {
  "creator": {"type": "object", "additionalProperties":false,"required": ["name", "affiliation", "attribution_mode"], "properties": {
    "name": {"type": "string"}, "affiliation": {"type": "string"},
    "attribution_mode": {"enum": ["name", "name_and_affiliation", "anonymous"]},
    "orcid": {"type": ["string", "null"], "pattern": "^[0-9]{4}-[0-9]{4}-[0-9]{4}-[0-9]{3}[0-9X]$"},"role":{"type":"string"},"location_label":{"type":["string","null"]},"website":{"type":["string","null"]},"source_measurement_uuid":{"type":["string","null"]}
  }},
  "publisher":{"type":"object","additionalProperties":false,"required":["name","url","location_label"],"properties":{"name":{"type":"string"},"url":{"type":"string"},"location_label":{"type":"string"}}},
  "submitter":{"type":"object","additionalProperties":false,"required":["relationship_to_measurement"],"properties":{"display_name":{"type":["string","null"]},"relationship_to_measurement":{"enum":["measurer","setup_owner","dealer","technician","researcher","other"]}}},
  "consent":{"type":"object","additionalProperties":false,"required":["public_data_submission","attribution_confirmed","license_confirmed"],"properties":{"public_data_submission":{"type":"boolean"},"attribution_confirmed":{"type":"boolean"},"license_confirmed":{"type":"boolean"}}},
  "missing":{"enum":["not_recorded","not_available","not_applicable","not_confirmed"]},
  "numberOrMissing":{"oneOf":[{"type":"number"},{"$ref":"#/$defs/missing"}]},
  "nonNegativeOrMissing":{"oneOf":[{"type":"number","minimum":0},{"$ref":"#/$defs/missing"}]},
  "booleanOrMissing":{"oneOf":[{"type":"boolean"},{"$ref":"#/$defs/missing"}]},
  "device":{"type":"object","additionalProperties":false,"required":["model","os_version"],"properties":{"model":{"type":"string"},"os_version":{"type":"string"},"sensor_notes":{"type":["string","null"]}}},
  "software":{"type":"object","additionalProperties":false,"required":["name","application_version","analysis_method_version","platform","developer"],"properties":{"name":{"type":"string"},"application_version":{"type":"string"},"analysis_method_version":{"type":"string"},"platform":{"type":"string"},"developer":{"type":"string"}}},
  "automaticProvenance":{"type":"object","additionalProperties":false,"required":["app_name","app_version","app_build","platform","device_hardware_identifier","device_display_model","os_name","os_version","timezone","analysis_method_version"],"properties":{"app_name":{"type":"string"},"app_version":{"type":"string"},"app_build":{"type":["string","null"]},"platform":{"type":"string"},"device_hardware_identifier":{"type":"string"},"device_display_model":{"type":["string","null"]},"os_name":{"type":"string"},"os_version":{"type":"string"},"timezone":{"type":"string"},"analysis_method_version":{"type":"string"},"dominant_peak_method_version":{"type":"string"}}},
  "state":{"enum":["present","not_present","tracking","not_tracking","on","off","rotating","stationary","active","inactive","not_recorded","not_available","not_applicable","not_confirmed"]},
  "rpmState":{"type":"object","additionalProperties":false,"required":["target_rpm","record_state","stylus_state"],"properties":{"target_rpm":{"$ref":"#/$defs/nonNegativeOrMissing"},"record_state":{"enum":["present","not_present","not_recorded","not_applicable"]},"stylus_state":{"enum":["tracking","not_tracking","not_recorded","not_applicable"]}}},
  "rpmConditions":{"type":"object","additionalProperties":false,"required":["device","measurement_duration_s","repeat_number","rpm_test_state"],"properties":{"device":{"$ref":"#/$defs/device"},"measurement_duration_s":{"$ref":"#/$defs/nonNegativeOrMissing"},"repeat_number":{"type":["integer","null"]},"rpm_test_state":{"$ref":"#/$defs/rpmState"}}},
  "vibrationContext":{"type":"object","additionalProperties":false,"required":["support","support_description","isolation","isolation_description","floor_type","floor_description","phone_position","phone_orientation","phone_placement_note","motor_state","platter_state","record_state","stylus_state","speaker_state","environment_note","playback_level_note"],"properties":{"support":{"enum":["floor_stand","equipment_rack","wall_shelf","dedicated_platform","furniture","other","not_recorded","not_available","not_applicable","not_confirmed"]},"support_description":{"type":["string","null"]},"isolation":{"enum":["none","built_in_turntable_suspension","isolation_feet","isolation_platform","pneumatic_air_isolation","other","not_recorded","not_available","not_applicable","not_confirmed"]},"isolation_description":{"type":["string","null"]},"floor_type":{"enum":["suspended_timber_floor","concrete_solid_floor","solid_floor","other","not_recorded","not_available","not_applicable","not_confirmed"]},"floor_description":{"type":["string","null"]},"phone_position":{"enum":["platter","turntable_plinth","plinth","top_plate","turntable_support","equipment_rack","floor","other","not_recorded","not_available","not_applicable","not_confirmed"]},"phone_orientation":{"enum":["face_up","face_down","portrait","landscape","other","not_recorded","not_available","not_applicable","not_confirmed"]},"phone_placement_note":{"type":["string","null"]},"motor_state":{"$ref":"#/$defs/state"},"platter_state":{"$ref":"#/$defs/state"},"record_state":{"$ref":"#/$defs/state"},"stylus_state":{"$ref":"#/$defs/state"},"speaker_state":{"$ref":"#/$defs/state"},"environment_note":{"type":["string","null"]},"playback_level_note":{"type":["string","number","null"]}}},
  "vibrationConditions":{"type":"object","additionalProperties":false,"required":["device","measurement_duration_s","repeat_number","vibration_context"],"properties":{"device":{"$ref":"#/$defs/device"},"measurement_duration_s":{"$ref":"#/$defs/nonNegativeOrMissing"},"repeat_number":{"type":["integer","null"]},"vibration_context":{"$ref":"#/$defs/vibrationContext"}}},
  "range":{"type":"object","additionalProperties":false,"required":["lower","upper"],"properties":{"lower":{"type":"number","minimum":0},"upper":{"type":"number","minimum":0}}},
  "comparisonRange":{"type":"object","additionalProperties":false,"required":["lower","upper"],"properties":{"lower":{"type":"number"},"upper":{"type":"number"}}},
  "rpmResult":{"type":"object","additionalProperties":false,"required":["target_rpm","average_rpm","speed_error_percent","speed_error_rpm","peak_deviation_positive_percent","peak_deviation_negative_percent","speed_standard_deviation_rpm","test_duration_s","wow_rms_percent","flutter_rms_percent","wow_flutter_rms_percent","weighting","analysis_method_version","series_file","spectrum_file"],"properties":{"target_rpm":{"type":"number"},"average_rpm":{"type":"number"},"speed_error_percent":{"type":"number"},"speed_error_rpm":{"type":"number"},"peak_deviation_positive_percent":{"type":"number"},"peak_deviation_negative_percent":{"type":"number"},"speed_standard_deviation_rpm":{"type":"number"},"test_duration_s":{"type":"number"},"wow_rms_percent":{"type":"number"},"flutter_rms_percent":{"type":"number"},"wow_flutter_rms_percent":{"type":"number"},"weighting":{"const":"unweighted"},"analysis_method_version":{"type":"string"},"series_file":{"type":"string"},"spectrum_file":{"type":"string"},"wow_band_hz":{"$ref":"#/$defs/range"},"flutter_band_hz":{"$ref":"#/$defs/range"},"wow_flutter_band_hz":{"$ref":"#/$defs/range"},"source_measurement_uuid":{},"source_measurement_timestamp_utc":{},"package_conditions_apply":{},"notes":{}}},
  "band":{"type":"object","additionalProperties":false,"required":["label","lower_hz","upper_hz","energy_percent","rms_mg"],"properties":{"label":{"enum":["Low","Mid","High"]},"lower_hz":{"type":"number","minimum":0},"upper_hz":{"type":"number","minimum":0},"energy_percent":{"type":"number","minimum":0,"maximum":100,"description":"Band power divided by total 1-40 Hz power, expressed as percent."},"rms_mg":{"type":"number","minimum":0,"description":"Band RMS contribution as defined by the measurement's declared Vibration analysis method version."}}},
  "peak":{"type":"object","additionalProperties":false,"required":["frequency_hz","amplitude_mg"],"properties":{"frequency_hz":{"type":"number","minimum":0},"amplitude_mg":{"type":"number","minimum":0},"classification":{"type":"string"}}},
  "vibrationResult":{"type":"object","additionalProperties":false,"required":["capture_rms_mg","capture_peak_mg","test_duration_s","analysis_range_hz","bands","dominant_peaks","distinct_peak_detected","series_file","spectrum_file","analysis_method_version","dominant_peak_method_version"],"properties":{"capture_rms_mg":{"type":"number"},"capture_peak_mg":{"type":"number"},"test_duration_s":{"type":"number"},"analysis_range_hz":{"$ref":"#/$defs/range"},"bands":{"type":"array","minItems":3,"maxItems":3,"prefixItems":[{"allOf":[{"$ref":"#/$defs/band"},{"properties":{"label":{"const":"Low"},"lower_hz":{"const":1},"upper_hz":{"const":8}}}]},{"allOf":[{"$ref":"#/$defs/band"},{"properties":{"label":{"const":"Mid"},"lower_hz":{"const":8},"upper_hz":{"const":20}}}]},{"allOf":[{"$ref":"#/$defs/band"},{"properties":{"label":{"const":"High"},"lower_hz":{"const":20},"upper_hz":{"const":40}}}]}],"items":false},"dominant_peaks":{"type":"array","maxItems":5,"description":"Strongest descriptive local maxima, independent of significance classification.","items":{"$ref":"#/$defs/peak"}},"distinct_peak_detected":{"allOf":[{"$ref":"#/$defs/booleanOrMissing"}],"description":"Stored legacy-compatible distinct-peak Boolean for measurement evidence only; Combined Analysis 2.0 applies its separate versioned nearby-feature classifier."},"series_file":{"type":"string"},"spectrum_file":{"type":"string"},"analysis_method_version":{"type":"string"},"dominant_peak_method_version":{"type":"string"},"source_measurement_uuid":{},"source_measurement_timestamp_utc":{},"package_conditions_apply":{},"notes":{}}},
  "resonancePrediction":{"type":"object","additionalProperties":false,"required":["analysis_method_version","effective_mass_g","cartridge_mass_g","mounting_hardware_mass_g","compliance_used_um_mn","predicted_resonance_hz","reference_region_hz","classification"],"properties":{"analysis_method_version":{},"effective_mass_g":{},"cartridge_mass_g":{},"mounting_hardware_mass_g":{},"compliance_used_um_mn":{},"predicted_resonance_hz":{},"reference_region_hz":{"$ref":"#/$defs/range"},"classification":{},"notes":{"type":["string","null"]}}},
  "measuredEnergy":{"type":"object","additionalProperties":false,"required":["rms_mg","energy_percent"],"properties":{"rms_mg":{},"energy_percent":{}}},
  "combinedAnalysis":{"type":"object","additionalProperties":false,"required":["analysis_method_version","predicted_resonance_hz","assessment","resonance_position","coverage","measurement_state","peak_relationship","confidence","summary","detail","recommendations","limitation"],"properties":{"analysis_method_version":{},"predicted_resonance_hz":{},"comparison_window_hz":{"$ref":"#/$defs/comparisonRange"},"measured_energy_near_prediction":{"$ref":"#/$defs/measuredEnergy"},"assessment":{"enum":["not_assessed","low_overlap","moderate_overlap","high_overlap","informational"]},"resonance_position":{"enum":["unavailable","below_preferred","within_preferred","above_preferred"]},"coverage":{"enum":["unavailable","full","partial","outside"]},"measurement_state":{"enum":["no_measurement","unusable_measurement","valid_measurement"]},"peak_relationship":{"enum":["unknown","no_dominant_peaks","peaks_elsewhere","significant_peaks_elsewhere","local_peak_near_prediction","significant_peak_near_prediction","several_features_near_prediction"]},"confidence":{"enum":["sufficient","limited","unavailable"]},"summary":{"type":"string"},"detail":{"type":"string"},"recommendations":{"type":"array","items":{"type":"string"}},"interpretation":{"type":["string","null"]},"limitation":{"type":["string","null"]}}},
  "rpmResults":{"type":"object","additionalProperties":false,"required":["rpm"],"properties":{"rpm":{"$ref":"#/$defs/rpmResult"},"resonance_prediction":{"$ref":"#/$defs/resonancePrediction"},"combined_analysis":{"$ref":"#/$defs/combinedAnalysis"},"stylus_usage_snapshot":{"$ref":"#/$defs/stylusUsage"}}},
  "vibrationResults":{"type":"object","additionalProperties":false,"required":["vibration"],"properties":{"vibration":{"$ref":"#/$defs/vibrationResult"},"resonance_prediction":{"$ref":"#/$defs/resonancePrediction"},"combined_analysis":{"$ref":"#/$defs/combinedAnalysis"},"stylus_usage_snapshot":{"$ref":"#/$defs/stylusUsage"}}},
  "stylusUsage":{"type":"object","additionalProperties":false,"required":["timing","usage_hours","tracking_source"],"properties":{"timing":{"const":"at_measurement"},"usage_hours":{"$ref":"#/$defs/nonNegativeOrMissing"},"tracking_source":{"type":"string"},"recorded_at":{"oneOf":[{"type":"string","format":"date-time"},{"type":"null"}]}}},
  "setupSnapshot":{"oneOf":[{"type":"object","additionalProperties":false,"required":["state"],"properties":{"state":{"const":"not_available"}}},{"type":"object","additionalProperties":false,"required":["setup_uuid","setup_name","tonearm_manufacturer","tonearm_model","cartridge_manufacturer","cartridge_model"],"properties":{"setup_uuid":{"type":"string","format":"uuid"},"setup_name":{"type":"string"},"turntable_manufacturer":{"type":["string","null"]},"turntable_model":{"type":["string","null"]},"drive_type":{"type":["string","null"]},"suspension_type":{"type":["string","null"]},"tonearm_manufacturer":{"type":"string"},"tonearm_model":{"type":"string"},"tonearm_effective_mass_g":{"type":"number","minimum":0},"cartridge_manufacturer":{"type":"string"},"cartridge_model":{"type":"string"},"cartridge_mass_g":{"type":"number","minimum":0},"mounting_hardware_mass_g":{"type":"number","minimum":0},"vertical_tracking_force_g":{"type":["number","null"],"minimum":0},"anti_skate_setting":{"type":["string","null"]},"alignment_geometry":{"type":["string","null"]},"azimuth_setting":{"type":["string","null"]},"vta_or_sra_setting":{"type":["string","null"]},"platter_mat":{"type":["string","null"]},"clamp_or_record_weight":{"type":["string","null"]},"compliance_used_10hz_um_mn":{"type":"number","minimum":0},"predicted_resonance_hz":{"type":["number","null"],"minimum":0}}}]},
  "provenance":{"type":"object","additionalProperties":false,"required":["source_type","data_entry_method","known_limitations","setup_metadata_source","raw_sensor_data_published","raw_sensor_data_note"],"properties":{"source_type":{},"source_file":{},"data_entry_method":{},"known_limitations":{"type":"array"},"setup_metadata_source":{},"raw_sensor_data_published":{"type":"boolean"},"raw_sensor_data_note":{}}},
  "files":{"type":"object","additionalProperties":false,"properties":{"human_readable_record":{},"images":{"type":"array"},"measurement_json":{},"rpm_series_csv":{},"rpm_spectrum_csv":{},"source_report":{},"vibration_series_csv":{},"vibration_spectrum_csv":{}}}
  }
}
