{"schema_version":"2.0.0","measurement_uuid":"8975ba49-1701-4534-b457-7517fc4d2cfa","public_measurement_id":"RL-2026-000006","setup_uuid":"e06a5c25-c861-4acc-bb49-b88f5c56bad5","public_setup_id":"DSR-SETUP-0002","publication_status":"published","measurement_type":"vibration_measurement","measurement_datetime":"2026-08-24T19:44:58.315Z","measurement_datetime_local":"2026-08-24T20:44:58.315+01:00","measurement_started_at":"2026-08-24T19:44:38.285Z","measurement_completed_at":"2026-08-24T19:44:58.315Z","measurement_timezone":"Europe/London","creator":{"affiliation":"","attribution_mode":"anonymous","name":"Anonymous contributor","role":"Measurement author","source_measurement_uuid":"8975BA49-1701-4534-B457-7517FC4D2CFA"},"publisher":{"location_label":"London–Rome","name":"Direct Sound Records","url":"https://directsoundrecords.com/"},"software":{"analysis_method_version":"reference-package-1.0.0","application_version":"1.0","developer":"Direct Sound Records","name":"Resonance Lab","platform":"iOS 26.6.1"},"automatic_provenance":{"analysis_method_version":"vibration-1-40-1.1.0","app_build":"2","app_name":"Resonance Lab","app_version":"1.0","device_display_model":"iPhone","device_hardware_identifier":"iPhone16,1","dominant_peak_method_version":"vibration-peaks-1.1.0","os_name":"iOS","os_version":"26.6.1","platform":"iOS","timezone":"Europe/London"},"conditions":{"device":{"model":"iPhone16,1","os_version":"26.6.1","sensor_notes":"Core Motion sensors in the device; no laboratory instrument certification is claimed."},"measurement_duration_s":20.029948791663628,"repeat_number":1,"vibration_context":{"environment_note":null,"floor_description":null,"floor_type":"not_recorded","isolation":"not_recorded","isolation_description":null,"motor_state":"not_recorded","phone_orientation":"not_recorded","phone_placement_note":null,"phone_position":"not_recorded","platter_state":"not_recorded","playback_level_note":"not_recorded","record_state":"not_recorded","speaker_state":"not_recorded","stylus_state":"not_recorded","support":"not_recorded","support_description":"not_recorded"}},"setup_snapshot":{"state":"not_available"},"results":{"combined_analysis":{"analysis_method_version":"combined-analysis-2.0.0","assessment":"moderate_overlap","comparison_window_hz":{"lower":6.871672966664561,"upper":8.871672966664562},"confidence":"limited","coverage":"full","detail":"A local spectral maximum occurs at 7.20 Hz near the predicted resonance region, but measurement confidence was insufficient to classify it as a significant/confident nearby feature. Most measured vibration energy lies above the predicted comparison region.","interpretation":"The calculated cartridge/tonearm resonance is 7.87 Hz, below the preferred 8–12 Hz region.\n\nA local spectral maximum occurs at 7.20 Hz near the predicted resonance region, but measurement confidence was insufficient to classify it as a significant/confident nearby feature. Most measured vibration energy lies above the predicted comparison region.","limitation":"The phone measures mechanical vibration at its placement point. This contextual comparison does not directly measure or prove cartridge/tonearm or stylus/cantilever resonance, acoustic feedback, motor/bearing resonance, structural resonance, a specific cause, or causation. The ±1.0 Hz comparison window is a deterministic comparison rule, not a precision claim.","measured_energy_near_prediction":{"energy_percent":6.024042402297424,"rms_mg":0.26759996757068694},"measurement_state":"valid_measurement","peak_relationship":"local_peak_near_prediction","predicted_resonance_hz":7.871672966664561,"recommendations":["Repeat the measurement if stronger evidence near the predicted resonance region is required. Address the recorded confidence limitation: Overall vibration was within 3 dB of the measured pre-capture floor.","If you want to raise the calculated resonance, reduce total moving mass where practical or consider a lower-compliance cartridge; evaluate that calculation separately from the phone vibration result."],"resonance_position":"below_preferred","summary":"The calculated cartridge/tonearm resonance is 7.87 Hz, below the preferred 8–12 Hz region."},"resonance_prediction":{"analysis_method_version":"resonance-1.0.0","cartridge_mass_g":7.2,"classification":"below_reference","compliance_used_um_mn":20,"effective_mass_g":12.2,"mounting_hardware_mass_g":1,"notes":"Calculated prediction; not a phone vibration measurement.","predicted_resonance_hz":7.871672966664561,"reference_region_hz":{"lower":8,"upper":12}},"stylus_usage_snapshot":{"recorded_at":"2026-08-24T19:44:58.315Z","timing":"at_measurement","tracking_source":"not_available","usage_hours":"not_available"},"vibration":{"analysis_method_version":"vibration-1-40-1.1.0","analysis_range_hz":{"lower":1,"upper":40},"bands":[{"energy_percent":19.50937793405438,"label":"Low","lower_hz":1,"rms_mg":0.48329620465899914,"upper_hz":8},{"energy_percent":30.18641544025627,"label":"Mid","lower_hz":8,"rms_mg":0.6011702021410643,"upper_hz":20},{"energy_percent":50.30420662568935,"label":"High","lower_hz":20,"rms_mg":0.7760573663721053,"upper_hz":40}],"capture_peak_mg":2.719701508262444,"capture_rms_mg":1.0941873099614274,"distinct_peak_detected":false,"dominant_peak_method_version":"vibration-peaks-1.1.0","dominant_peaks":[{"amplitude_mg":0.1484195635400409,"frequency_hz":6.325488900038109},{"amplitude_mg":0.1387252266615454,"frequency_hz":7.20132582465877},{"amplitude_mg":0.13867433204776533,"frequency_hz":4.865760692337007},{"amplitude_mg":0.13439750230260156,"frequency_hz":24.718064317071995},{"amplitude_mg":0.13377895862961023,"frequency_hz":32.308650997117724}],"notes":"Phone acceleration at its placement point; this does not directly measure cartridge/tonearm resonance.","package_conditions_apply":true,"series_file":"not_published","source_measurement_timestamp_utc":"2026-08-24T19:44:58.315Z","source_measurement_uuid":"8975BA49-1701-4534-B457-7517FC4D2CFA","spectrum_file":"not_published","test_duration_s":20.029948791663628}},"provenance":{"data_entry_method":"Structured record created from Resonance Lab results and documented setup metadata.","known_limitations":["No precise geographic coordinates, account data or device serial numbers are exported.","Setup fields marked with explicit missing-state tokens were not invented by the exporter.","Vibration is measured by the phone at its placement location, not at the stylus/groove interface.","Stylus usage is the cumulative tracker value at package export time. Historical usage at the selected measurement time was not retained and is marked not_available."],"raw_sensor_data_note":"RPM series are stored analysis trace points; vibration series are the stored processed 1-40 Hz signal. Original Core Motion sensor streams are not included.","raw_sensor_data_published":false,"setup_metadata_source":"Resonance Lab saved setup","source_file":"not_available","source_type":"Resonance Lab measurement/export"},"files":{"human_readable_record":"README.md","images":[],"measurement_json":"measurement.json","rpm_series_csv":"not_available","rpm_spectrum_csv":"not_available","source_report":"not_available","vibration_series_csv":"not_published","vibration_spectrum_csv":"not_published"},"license":"CC-BY-4.0","measurement_authors":[{"affiliation":"","attribution_mode":"anonymous","name":"Anonymous contributor","role":"Measurement author","source_measurement_uuid":"8975BA49-1701-4534-B457-7517FC4D2CFA"}],"recommended_citation":"Anonymous contributor. “Technics SL-1410 mk2 / AMG 12J2 / Ortofon 2M Blue — Measurement, 24 August 2026.” Resonance Lab Measurement RL-2026-000006. Published by Direct Sound Records.","publication_consent":{"attribution_confirmed":true,"license_confirmed":true,"public_data_submission":true},"record_version":"0.1.0","language":"en","keywords":["1-40 Hz","12J2","2M Blue","AMG","Ortofon","Resonance Lab","SL-1410 mk2","Technics","Technics SL-1410mk2","cartridge tonearm resonance","turntable","vibration"],"measurement_scope":["combined_analysis","resonance_prediction","setup_metadata","stylus_usage_snapshot","vibration"],"related_applications":[],"related_measurements":[],"slug":"rl-2026-000006","source_measurement_uuids":["8975BA49-1701-4534-B457-7517FC4D2CFA"],"submitter":{"relationship_to_measurement":"measurer"},"title":"RL-2026-000006 - Technics SL-1410 mk2 / AMG 12J2 / Ortofon 2M Blue","date_published":"2026-08-24T20:06:34Z"}
