{"$schema":"../../../../schemas/measurement.schema.json","automatic_provenance":{"analysis_method_version":"rpm-wf-1.0.0","app_build":"2","app_name":"Resonance Lab","app_version":"1.0","device_display_model":"iPhone","device_hardware_identifier":"iPhone16,1","os_name":"iOS","os_version":"26.6.1","platform":"iOS","timezone":"Europe/London"},"conditions":{"device":{"model":"iPhone16,1","os_version":"26.6.1","sensor_notes":"Core Motion sensors in the device; no laboratory instrument certification is claimed."},"measurement_duration_s":15.001491125003668,"repeat_number":1,"rpm_test_state":{"record_state":"present","stylus_state":"tracking","target_rpm":33.333333333333336}},"creator":{"affiliation":"","attribution_mode":"anonymous","name":"Anonymous contributor","role":"Measurement author","source_measurement_uuid":"F3FAC6BA-3D6F-4E4B-868B-C68CE34F230D"},"files":{"human_readable_record":"README.md","images":[],"measurement_json":"measurement.json","rpm_series_csv":"not_published","rpm_spectrum_csv":"not_published","source_report":"not_applicable","vibration_series_csv":"not_available","vibration_spectrum_csv":"not_available"},"interpretation":{"comparison_limitations":["Phone placement, orientation, support, operating state and environment affect vibration comparisons.","The phone measures mechanical vibration at its placement point. This contextual comparison does not directly measure or prove cartridge/tonearm or stylus/cantilever resonance, acoustic feedback, motor/bearing resonance, structural resonance, a specific cause, or causation. The ±1.0 Hz comparison window is a deterministic comparison rule, not a precision claim.","Resonance Lab does not claim laboratory vibration-instrument certification."],"recommendation":"If you want to raise the calculated resonance, reduce total moving mass where practical or consider a lower-compliance cartridge; evaluate that calculation separately from the phone vibration result.","repeat_required":false,"summary":"The calculated cartridge/tonearm resonance is 7.87 Hz, below the preferred 8–12 Hz region.\n\nNo Vibration observation is associated with this RPM measurement; combined Resonance × Vibration interpretation is not applicable to this record."},"keywords":["12J2","2M Blue","AMG","Ortofon","RPM","Resonance Lab","SL-1410 mk2","Technics","Technics SL-1410mk2","cartridge tonearm resonance","turntable","wow and flutter"],"language":"en","license":"CC-BY-4.0","measurement_authors":[{"affiliation":"","attribution_mode":"anonymous","name":"Anonymous contributor","role":"Measurement author","source_measurement_uuid":"F3FAC6BA-3D6F-4E4B-868B-C68CE34F230D"}],"measurement_completed_at":"2026-08-24T17:07:36.666Z","measurement_datetime":"2026-08-24T17:07:36.666Z","measurement_datetime_local":"2026-08-24T18:07:36.666+01:00","measurement_scope":["combined_analysis","resonance_prediction","rpm","setup_metadata","stylus_usage_snapshot","wow_flutter"],"measurement_started_at":"2026-08-24T17:07:21.665Z","measurement_timezone":"Europe/London","measurement_type":"rpm_measurement","measurement_uuid":"f3fac6ba-3d6f-4e4b-868b-c68ce34f230d","provenance":{"data_entry_method":"Structured record created from Resonance Lab results and documented setup metadata.","known_limitations":["No precise geographic coordinates, account data or device serial numbers are exported.","Setup fields marked with explicit missing-state tokens were not invented by the exporter.","The RPM CSV contains the persisted analysis trace, which may be downsampled from the internal uniform series.","Stylus usage is the cumulative tracker value at package export time. Historical usage at the selected measurement time was not retained and is marked not_available."],"raw_sensor_data_note":"RPM series are stored analysis trace points; vibration series are the stored processed 1-40 Hz signal. Original Core Motion sensor streams are not included.","raw_sensor_data_published":false,"setup_metadata_source":"Resonance Lab saved setup","source_file":"not_available","source_type":"Resonance Lab measurement/export"},"public_measurement_id":"RL-2026-000005","public_setup_id":"DSR-SETUP-0002","publication_consent":{"attribution_confirmed":true,"license_confirmed":true,"public_data_submission":true},"publication_status":"published","publisher":{"location_label":"London–Rome","name":"Direct Sound Records","url":"https://directsoundrecords.com/"},"recommended_citation":"Anonymous contributor. “Technics SL-1410 mk2 / AMG 12J2 / Ortofon 2M Blue — Measurement, 24 August 2026.” Resonance Lab Measurement RL-2026-000005. Published by Direct Sound Records.","record_version":"0.1.0","related_applications":[],"related_measurements":[],"results":{"combined_analysis":{"analysis_method_version":"combined-analysis-2.0.0","assessment":"not_assessed","comparison_window_hz":{"lower":6.871672966664561,"upper":8.871672966664562},"confidence":"unavailable","coverage":"unavailable","detail":"No Vibration observation is associated with this RPM measurement; combined Resonance × Vibration interpretation is not applicable to this record.","interpretation":"The calculated cartridge/tonearm resonance is 7.87 Hz, below the preferred 8–12 Hz region.\n\nNo Vibration observation is associated with this RPM measurement; combined Resonance × Vibration interpretation is not applicable to this record.","limitation":"The phone measures mechanical vibration at its placement point. This contextual comparison does not directly measure or prove cartridge/tonearm or stylus/cantilever resonance, acoustic feedback, motor/bearing resonance, structural resonance, a specific cause, or causation. The ±1.0 Hz comparison window is a deterministic comparison rule, not a precision claim.","measurement_state":"no_measurement","peak_relationship":"unknown","predicted_resonance_hz":7.871672966664561,"recommendations":["If you want to raise the calculated resonance, reduce total moving mass where practical or consider a lower-compliance cartridge; evaluate that calculation separately from the phone vibration result."],"resonance_position":"below_preferred","summary":"The calculated cartridge/tonearm resonance is 7.87 Hz, below the preferred 8–12 Hz region."},"resonance_prediction":{"analysis_method_version":"resonance-1.0.0","cartridge_mass_g":7.2,"classification":"below_reference","compliance_used_um_mn":20,"effective_mass_g":12.2,"mounting_hardware_mass_g":1,"notes":"Calculated prediction; not a phone vibration measurement.","predicted_resonance_hz":7.871672966664561,"reference_region_hz":{"lower":8,"upper":12}},"rpm":{"analysis_method_version":"rpm-wf-1.0.0","average_rpm":33.34448871388967,"flutter_band_hz":{"lower":6,"upper":20},"flutter_rms_percent":0.01810085877712008,"notes":"Wow uses [0.5, 6) Hz; flutter uses [6, 20] Hz. Values are unweighted when recorded as such.","package_conditions_apply":true,"peak_deviation_negative_percent":-0.12095416029531648,"peak_deviation_positive_percent":0.12000498893044735,"series_file":"not_published","source_measurement_timestamp_utc":"2026-08-24T17:07:36.666Z","source_measurement_uuid":"F3FAC6BA-3D6F-4E4B-868B-C68CE34F230D","spectrum_file":"not_published","speed_error_percent":0.03346614166899542,"speed_error_rpm":0.011155380556331806,"speed_standard_deviation_rpm":0.011077105348463994,"target_rpm":33.333333333333336,"test_duration_s":15.001491125003668,"weighting":"unweighted","wow_band_hz":{"lower":0.5,"upper":6},"wow_flutter_band_hz":{"lower":0.5,"upper":20},"wow_flutter_rms_percent":0.026589946078231563,"wow_rms_percent":0.019477785910467775},"stylus_usage_snapshot":{"recorded_at":"2026-08-24T17:07:36.666Z","timing":"at_measurement","tracking_source":"not_available","usage_hours":"not_available"}},"schema_version":"2.0.0","setup_snapshot":{"state":"not_available"},"setup_uuid":"e06a5c25-c861-4acc-bb49-b88f5c56bad5","slug":"rl-2026-000005","software":{"analysis_method_version":"reference-package-1.0.0","application_version":"1.0","developer":"Direct Sound Records","name":"Resonance Lab","platform":"iOS 26.6.1"},"source_measurement_uuids":["F3FAC6BA-3D6F-4E4B-868B-C68CE34F230D"],"submitter":{"relationship_to_measurement":"measurer"},"title":"RL-2026-000005 - Technics SL-1410 mk2 / AMG 12J2 / Ortofon 2M Blue","date_published":"2026-08-24T20:06:34Z"}
